Author.ID,Text_nolink,Assigned_Topic
1641217131814567936,My. Goodness.,4
4731211670,I’m always being a dick. But not a DICK! 🤣,4
566383662,"It’s easier to stay motivated working on a hard task that’s straightforward 

Than it is to stay motivated working on an easy task that’s confusing

If you have no clear path forward it’s near impossible to stay consistent

If you have a clear path forward, you’ll push on no…",4
1657156813262045184,They’re just past that point and they’re so deep into their loa journey they probably don’t even know how to dumb it down for beginners,4
1657156813262045184,Exactly!!,4
566383662,"LOL easily the worst copy I’ve ever seen

This would print if it actually read like a blonde girl wrote it",7
908360266970271744,And every night you all deliver an amazing show and look happy and energized. Very very impressive 👏,4
756224175144960000,Don't RT these losers and give them attention. They're braindead morons,4
1598888326857097216,"Wow, appearently this is a trend with schools now. I had something similar happen to my son. I was pissed, I addressed it with the principal they ensured me they would get it to stop and prevent it from happening again. It didn’t, the kid followed my son in the bathroom and tried…",4
908360266970271744,I think it’s more than that. College students and people starting out in the workforce want to know that they’ve earned their place. DEI and equality of outcome is absolutely soul crushing and almost everyone hates it.,7
1480623451933052928,What is wrong with these people?,4
1480623451933052928,That would be awesome,4
1586322261958598656,Jesus,4
4731211670,I think we have to find a way to make people want to be smarter. Maybe a social media app where if you answer questions correctly you get attention.,4
1545556106663149568,An obsession with health is a healthy obsession,4
129018409,"please #Starlink us a solution, you owe it to us 🇨🇦. Do your thing, disrupt our tyrannical oligopoly.",4
1595592290637991936,“We’re better off connecting” but we’re going to continue fighting for division? 🤷‍♂️,4
1703496705063231488,When are you gonna run for prez again?,4
1595592290637991936,Dang! For real!,4
1062403518336851968,You’ll be okay,4
1813677350816514048,Our taxes pay for transparency and accountability! NO SECRET BALLOTS!,6
1630787016894889984,"I'm still here. I'm still single. I've never cheated. Heck, I've never even had a girlfriend.",7
1590337719066132480,That’s what you get for being old enough to know better but still crazy enough not to do better. Shame on you.,4
1444263252460986368,Treason. Ok.,4
1813677350816514048,"I am still laughing at this! Turturkey, not a turducken!  Coming to a Thanksgiving table near you! 🤣🤣🤣",7
1459952867670999040,Tattooing ur dick has gotta be so painful,4
288132586,I thought what is happening now was going to happen 4 years ago... But here we are...,4
21246371,"Maybe if the media would stop ""Trumpsplaining"" and call out the reality of his comments, policies, and legal issues instead of holding him and others on an equal status, when in reality, there is no equal to what he says and does. Democracy dies when the press fails.",4
2557304533,"There’s an interesting contrast with the Jordan movie, where Slater and Pitt are in an nice penthouse that is also extremely dumpy, that part of things sort of looks like shit because Jordan is heightening the fantasy only on one side of the story.",4
1590337719066132480,Me toooooooo,4
1590337719066132480,Liberal locks 🤦🏻‍♀️,4
1784714898993254400,"I’m in the UK, but I have raised my 18yo daughter to be respectful and independent - hoping that she will be a useful member of society - adhere to law but speak up when she sees abuses",4
1271358442234679296,Bob is going to lead the charge on the Capitol building! Stop the steal!!,4
1459952867670999040,Dude was there for 11 years felt like,4
1599265344849432576,in 5 seconds,4
1788454997706833920,I think the human traffickers are first on the list then violent gangs. Funds will be shut off. Look to Jordan and how the free cell phones can be tracked .,7
1813677350816514048,"She can. With about 725,000 ballots left, mostly leaning red, she needs 58% of those votes or better to get over the recount hump and win.",4
1791977924716871680,Stuff a tampon into him already.,4
1813677350816514048,"I’m being more cautious; 57%. I’d be ecstatic with your 51.9%! Let’s do this,  💪🏻💪🏻💪🏻🇺🇸🇺🇸🇺🇸",4
1813677350816514048,Not sure it’s because of the Senate race. 😏,4
1791977924716871680,Elon needs to turn off Star Link in Ukraine and the war would be over tomorrow.,4
1784714898993254400,Where is the ? Why aren’t our shores being protected from foreign invaders? That’s what this is!,4
1271358442234679296,lol Bob is going be super disappointed when it doesn't happen.,4
1587602757007118336,And are these 81 million votes in the room with us right now?,4
1784714898993254400,"Are there any white peope left in the UK? I think there might be, I think I spotted a few",4
853657965827469312,This is why Libertarians are lame,4
1813677350816514048,"I was suspended during “Twitter’s” censorship and collective bashing of Trump after being on since its inception. I vowed never to come back, until  I’m still cautiously optimistic, but freedom of speech feels damn good!",4
1271358442234679296,Apparently! Things are not going well for her.,4
1595592290637991936,🔥🔥🔥🔥🔥 so awesome!!!,4
1758351163940806656,"Wait, we can get rid of illegals and Feminists?! This is sounding like a new golden age is about to start!",5
41814811,"How will states pay for college educations, public school employee payrolls, AND elementary school kids’ sex changes?? States can’t afford it all.",4
1487671242169724928,That’s the point of the house,4
1271358442234679296,Lead us to the Capitol Bob!!! Stop the steal!!!,4
1641217131814567936,What in the whole wide world is this ?  How has this happened to so many. We loved his music. He went off the deep end.  My goodness.,4
17118419,"I like Ice Cube, but I've seen the demands...",7
1788454997706833920,Then we stop buying till they move manufacturing back here,4
756224175144960000,"Women need to judge the outcome of a policy, not the intention

Always ask, ""Do you actually want to help others, or do you want to look good &amp; sound nice while failing to help others?""",4
288132586,It's probably the best time to beef up security.,4
1605053449317539840,"This is why tyrants ultimately, always, lose. They better hope nothing happens to Biden before his term ends because all eyes will be on them.",4
288132586,Old English 800,4
1730568938894020608,"I know you can be disciplined, but exactly what the consequences are I have no idea.",4
1630787016894889984,"Personally, I think the priority of the conservative government should be stopping Ukraine payouts of any kind. Divert that money to Canada. He won't do it though. Both the liberals and the conservatives would rather support Ukraine over Canada.",4
1605053449317539840,"Really. Where does this come from? They did nothing when the border was overrun or when bugging out of Afghanistan; why would they do anything now - nothing untoward has been said or indicated. So, where does this come from? Because it is important to not feed unsubstantiated…",4
1630787016894889984,"Why is outlawing the covid vaccine not one of the options? The covid vaccine almost killed me, and it's left me with serious problems thinking and remembering things.",2
1850305347145416704,Fuckin faxx!,4
1595592290637991936,Semper Fi Brother! 👊,4
1850305347145416704,Because they retarded,4
1605053449317539840,"Amen! Peace be with you and all the children, everywhere. And will someone help this man with some facial reconstruction? And aid for the orphanage?",4
1850305347145416704,I’ll put it in crazy… but not bald crazy.,4
288132586,Nope. I'm in supposedly blue California. That part you see on the bottom left.,4
1587602757007118336,"Now, if McDonald's starts frying taters in tallow again, topped with sea salt, I'll be first in line, and I haven't eaten there in 20 years.",4
29467372,If a woman is not getting care for a miscarriage then that is malpractice. Maybe you should stop trying to act like you know something,4
1587602757007118336,"End LED lighting, end seed oils...",4
1487671242169724928,People should literally die for this.,4
288132586,America is going to look very different in the next year or two.,4
288132586,That dude is psycho. I wouldn't let my kids near him.,4
29467372,The name is accurate. She is a bug that needs to be swatted away lol.,4
1487671242169724928,I didn’t realize half of my friends and acquaintances were actually my enemies. I’ll really have to do some introspection.,4
1605053449317539840,"I think the truth will come out that he never was President, perhaps coerced to accept the role, under compromising circumstances; but not mentally capable from before the beginning and only acquiesced because of being compromised. That is about the best that is likely to ever be…",4
1605053449317539840,They are a drain on the will of the world and no one has time for that anymore.,4
1213779304162553856,glad to connect 🫶,4
1605053449317539840,"She D/N know what danger is, or families, or our country. What's dangerous is a nation suddenly tipped over into crime, drugs, invasion, bankruptcy, inflation. And she helped - that.",6
1325493791529242624,Who is the bald crybaby?,4
1444263252460986368,Don’t care it’s a mandate.,4
1605053449317539840,Remove it.,4
1391582450711736320,"Free speech goes both ways on this app. Excellent use of your resources. Orange man in office does not mean bigotry and sexism is endorsed.

What a fucking idiot",4
1605053449317539840,Condoleeza Rice is formidable and good. Ask her. She would help.,4
1703904798758543360,Creatures come from there and create fiat currency,4
1391582450711736320,Whoever sent them should be very prosecuted. Always get idiots like this trying to play a “joke.” But this ain’t funny. I hope the FBI finds them and shows them a nice time in a 10 x 10,6
1391582450711736320,Well what do you mean? What do you want to happen to us?,4
1702147875457662976,"Henry Kissinger paid for his education, I'm pretty sure he works for the CIA.",4
1595592290637991936,😂 “acquisition” at its finest 😂,4
1813677350816514048,Isn’t there a .5% recount trigger?,4
1062403518336851968,100k in the near future 👀,4
1605053449317539840,"True. Like lambs. And I think Zelensky believed the EU and 'Biden.' Freedom is an overwhelming desire when you are beset by grift, greed, corruption and threatened from every side. Ukraine deserved better than this 'war.' Notable was the no diplomacy visible, engaged. There is…",4
1685298505072463872,Not sure what they're trying to show us because his fat head is covering half the video.,4
1656480488411009024,Shove your Muslim BS.,0
1595592290637991936,Oh boy! At attention everyone! 🔥👊,4
1656480488411009024,😂🤣🤣Awesome  !!,4
17490749,"OH MY GOD, DON’T BE SO DRAMATIC. DOCTORS DON’T DENY CARE.",4
1656480488411009024,Psycho incorporated 😂😂😵‍💫🤡,4
2994003066,Wow. What the crap did you do?,4
40032780,We owe a debt of gratitude to Elon on so many levels. We appreciate you Elon! Government overreach was the factor for the Amish voting!,4
1647732834730233856,Their rhetoric and public policies are lies.,4
1758351163940806656,"If this admin backs away from deporting illegals at the rate that must be done because a bunch of ugly tiktok women get mad at a guy that didn't even vote for Trump, then they will never have the guts to handle the heat of actually deporting these illegals.",0
1674157915769274368,"Men will sacrifice for women, but only as a proxy for having a family and building a country. 
not just to f*ck the onlyfans wh*re",4
40032780,Thank you Charlie! Thank you so much!,4
1357681038487617536,And UBER,4
1758351163940806656,"If she hates red states so much, why doesn't she just move to a blue one?",4
2557304533,"There’s one bit toward the end of CANDYMAN when Todd scoops Helen up in his arms without flinching, carries her with a completely smooth stride and places her gingerly on a table and the look of pure love he gives her shifts the whole movie. An undeniably amazing actor.",4
1213779304162553856,"Health tech use is all about balance. 

Do you have any boundaries set before bedtime? 🌝",4
14589287,"I wonder how that would actually work, Constitutionally speaking. If the President-elect dies before being inaugurated does the VP-elect then automatically become the President-elect? And if they both die before being sworn in, who is next in line as P-E?",4
1391582450711736320,Ugh I’m going to have to hear the opposite end of the spectrum complain about vote counting for 4 more years. Aren’t I?,4
1630787016894889984,It's Canada under the liberals or the conservatives.. both of them have the same goal unfortunately. Canadians have always voted one of the two parties in. I don't see that changing.,4
14589287,"That’s the job of Congress, not the executive branch.",4
40032780,Wow! Thank you! I surely didn’t know this! We owe a debt of gratitude to Charlie on so many levels! What a patriot!  ❤️🇺🇸,4
1849149763968479232,"You have to love problems to succeed. 

Problems are going to come, Find The root cause and find a solution. Simple and execute.

Didnt work, try again. Didnt work, try different. Continue till you eventually succeed.",4
1391582450711736320,"The frightening part is you’re right, but most people don’t realize it. Their policies don’t really begin to show effect until 2-2.5 years in imo.",4
1319340954130747392,Baked beans.,4
1630787016894889984,"I've seen no evidence ""The people's voice community"" is anything more than a place where conspiracies are made up. I have never seen any evidence for what they say.",7
14589287,Must not have citations in MAGAland.,4
1391582450711736320,"If the companies don’t yield, mass tariffs will be an issue. What will help them actually work?

We as consumers have to buy American so the companies actually move like Trump wants them to. Otherwise, the cost moves to the consumer. 

#tariffs",4
1391582450711736320,I like “the Don.” 😂,4
40032780,"Yes, I’m with you! Some say Trump should let the process play out, but that’s not my thinking. Trump “made” this MAGA movement and only those that believe in it should be in leadership! I like that he said something about RONA …now he should do the same FOR “Rick Scott”
🙏",4
3139352364,"Exactly! Building bridges starts with empathy and understanding, not division. Recognizing the humanity in those we disagree with is crucial. By lowering the temperature and moving away from contempt, we might find common ground.",4
896672006,"Bring them back to the Cenk line. You used to be the far left and while we despised you, we at least understood your madness. The left has moved so far that you are starting to look sane. Bring them back to your level.",4
1391582450711736320,"Yeah, but we are accelerating it. Their media just doesn’t say that, which is why they are disingenuous. 

Let’s scale up nuclear power usage across our country and watch the climate activists run out of talking points.",4
1213779304162553856,I love when I get a nice workout &amp; shower before before ❣️ plus herbal tea — great sleep formula,4
1786557347474608128,0 jabs 0 tests.,4
3139352364,"So true, and a necessary reminder! Our emotions, while important, can obscure our view of others' humanity. Stepping back helps us appreciate the bigger picture and understand those we might disagree with. It's about choosing empathy and connection over division.",4
41814811,"Are we doing another Women’s March? Just wondering about a date, if there is one.",4
1213779304162553856,before bed*,4
1674157915769274368,"Thanks, yeah I have so many cool stories. 
Stay angry out there, fastest way to the dark side",4
40032780,"Yes, I’ve seen on X Trump being tagged so many times! This whole
Story is UNBELIEVABLE! This poor woman! 🙏",7
1587543128906649600,"Thank you for the update. You should be very proud of your son, it sounds like he has a kind heart",4
1838246001544482816,The democrats won’t win for another 100 years lol,4
1758351163940806656,She's become so insane her hair ran away from her head.,4
1446637564723560448,I agree with you. Musk is also a  genius.,4
1838246001544482816,Sometimes I see someone really struggling and I think about helping them out but then I see tweets like this and I’m like “nope. Not helping.” Women really will sell their soul for cash.,4
1446637564723560448,Yet you got your election prediction so wrong 🤣,4
1824841165771853824,*he would kill them but he’s too much of a pussy to risk f-ing around and finding out.,4
1630787016894889984,"They go home, and read twitter posts, or watch tv... or a movie.. maybe play a video game.",4
1661107961534488576,They can’t handle the truth,4
1838246001544482816,You don’t have to respond. They’ll live lol,4
896672006,"Rick Scott

This president just won a mandate. Rick Scott will remain true to what the people voted for. To give us anything less would be a betrayal to the majority that was given them.",4
122570279,Celtics are completely average without Jaylen Brown.,4
1446637564723560448,"Elon is very vocal about the fact AI needs to be regulated,  Trump wouldn't have won the election without free speech on X. X is helping destroy corporate media right now. Trump trusts Musk a lot &amp; I reckon Trump with his access to intelligence, has done due diligence.",4
1271358442234679296,Wow. He barely fits into the elevator.,4
1651445882670178304,"Yes, but I wish you could have done it before all those absentee ballots were sent in.",4
1640520587360587776,"Burn on burn on burn and so on..😂
🔥 🔥",4
1791977924716871680,Harry Balz and the Cucks,4
1824841165771853824,The audits will show us soon enough,4
1674157915769274368,"The left is full of a bunch of phony pretentious c*nts. 
Technically a person can read into anything and plaster meaning all over it to either look smart or push a narrative.  Or better yet both",1
1791977924716871680,Tampon Tim was a horrible choice.,7
1824841165771853824,"Joke’s on them, bald chicks can be hot AF",6
122570279,Tatum iso: still brutal,4
1271358442234679296,Depends if they voted for Kamala or Trump. If they voted for Kamala they are definitely illegal. If they voted for Trump they aren't illegal.,4
1674157915769274368,I blame everything on the stig too,4
1824841165771853824,Sorry to hear about your schizophrenia,4
1674157915769274368,Actually it's the first step in the vetting process.  Can you convincingly pretend to see some deep meaning in this drizzle,4
1758351163940806656,It helps us know who to avoid.,4
1595592290637991936,Looks like a blast!,4
1837344762,"Everyone I know from CA (Oregon resident) is either trying to move out, have a place out of CA, hate the politics, are thoroughly discouraged. Newsom is a joke to them. So 3-4 years may not be enough to turn it around.when I was young, everyone wanted to go to CA.",6
1611096531045605376,Ego a go-go.,4
1595592290637991936,You sure did brother! And that’s right we won!,4
1230315292573622272,That’s the disconnect. This isn’t going to be some artfully designed endeavor. ICE is going to drag anyone they want out of their homes and sort it out later. Maybe.,4
1758351163940806656,"Not all of us. I don't want anything to do with any of them. I do genuinely feel bad for the Palestinians, but I'm not about to go slurp a bunch of third worlders.",1
1595592290637991936,So awesome! Luv ya brother! 👊,4
3687426618,Please YES!! #JDVance2028 will win!! No problem!!,4
1639097825760882688,Thank you for everything Dan!,4
1319340954130747392,WWE crowns a woman before the United States can elect a woman Commander in Chief.,4
1319340954130747392,Concepts of a plan.,4
1373366725580886016,At least 2 flights a day 😂,4
1373366725580886016,Me too 😂,4
920734348994850816,Praying for a quick release. Praying for encouragement and strength in the Lord while she waits.,4
1820229092006039552,God Bless you Sir.,4
1640520587360587776,What in the world is up with that guy!??,4
1524965660,Good head on her shoulders.,4
1230828967042715648,"tell them that, and they think were crazy. These people don't live in reality.",4
1611096531045605376,"Great man, great patriot and American.",4
119239775,"Because even if I proved to you that some place has changed ten degrees in the past 100 years, you would’ve pulled the thermometer card aka a pivot. So you’re saying your point pretty much had zero merit, like the rest of your arguments.",7
808287562800439296,"It’s already illegal to employ them.  But we don’t enforce it.  Why?  

They’d stop coming if they couldn’t find work here.",4
22990834,"#ACIM Lesson 313
Now let a new perception come to me.

Father, there is a vision which beholds all things as sinless, so that fear has gone, and where it was is love invited in. And love will come wherever it is asked. This vision is Your gift. The eyes of Christ look on a world…",4
1487671242169724928,"“They will always choose their own over you”, Hispanic men just voted 54% for Trump. Seems they chose “Civic National bs” over racial solidarity bs. Anyone who wants a safe and better future for themselves and their family (and loves our country) is in the ingroup to me.",0
2604836674,I love me some Candlemass. Have since the 80s 🤘,4
785995075050467328,You don't have to have sex to have an orgasm.,4
1753549991308894208,Could all be dead voters from the past that left the party.,4
288132586,There should be more people marching in the streets against this.,4
1756080639646781440,I remember feeling like that when I was in uniform... 🦅,4
41814811,Iced coffee and Taylor swift.  Jesus isn’t real.,4
1455832193331122176,Pretty sure he’s had the codes through Biden’s fake 4 years.,4
3687426618,Her law school Hastings ranks 89th of US law schools &amp; she failed the bar exam!! #SCOTUS was always reserved for top grads from top law schools!! This suggestion is ridiculous!!,4
1213779304162553856,My armpits smell like brownies,4
2604836674,"Bro. I lost 700 mutuals. Still… enough cool peeps to keep me
around for now.",4
1756080639646781440,My Aura is all red white and blue now.. thanks! 🧘🏼‍♀️,4
3687426618,Hastings School of law ranks 89th &amp; it took her 2 or 3 tries to pass the bar—she is NOT #SCOTUS material!!,4
40032780,"I hope that President Trump endorses Rick! He built MAGA, it’s his party by a MAJORITY! He has every right to speak out! Thune AND Cornyn are MITCH flunkies. No thanks! RICK SCOTT is MAGA!",4
1230315292573622272,It’s fucking vile.,4
18831926,"4) I’m hearing info from inside T’s transition team that the top candidates for HHS Secretary are Bobby Jindal (former Louisiana governor), Paul Mango (former deputy chief of staff at T45’s HHS), and maybe Brett Giroir (Asst Sec of Health in T45 HHS). Anyone better than RFK.",4
1692544199625719808,Because this is soccer.,4
1391582450711736320,They’re an independent institution to avoid direct monetary manipulation by the executive branch tho. So he’s doing his job,4
1230315292573622272,My father was like this. I found it both confusing and disingenuous.,4
2604836674,"Where is Antifa anyways? We’ve slid full on into fascism and crickets 🦗 
Not that they owe us anything… but they’re not living up to the name, that’s for sure",7
1447306061518557184,Lmaooo that’s amazing. I wish you were my mentor,4
1455832193331122176,"I highly doubt it happens. Like I’d put money on it, they won’t.",4
768448265419317248,Sadly not everyone figures out not to touch a hot stove by watching other people burn themselves- they need to experience the blisters themselves,4
1446201996734877696,"Differentiating between accountability and retribution at this point is nauseating, wtf is the difference. For a non-believer like James he sure seems incredibly invested with being able to claim righteousness by exercising wordplay.",4
3687426618,"Amy Coney Barrett was in the top of her class at Notre Dame Law School, which ranks 20th in the country. #Kamala graduated from Hastings Law school which ranks 89th and she failed the bar exam 1st try, not sure her class rank but pretty sure not top!!",4
1230315292573622272,I don’t think it’s possible to shame that side into anything.,4
1426377746905657344,"This has sort of happened to me in times where I stumbled upon something that stimulated me to a new higher level.
These guys, holy shit. It's like giving an Amish guy a flying saucer.",4
2604836674,I was lucky enough to see them this year for the first time. It was cathartic AF. Crowd went bonkers. This old guy was in the pit for all the Nightfall tunes.,4
1230315292573622272,I’m not sure how they think they benefit. This country has the resources for everyone. Status be damned. It’s an allocation problem.,4
1447306061518557184,"That is a good feeling. And then you try to figure out what makes him charismatic to learn to be more charismatic yourself

It’s hot when men have skills you admire and want to learn to emulate in your own life",4
119239775,"Sorry, 120+ years, not 150. Again though, have a good night.",4
2350860516,That was a great win!! Blomma was fantastic!!!,4
